anime_id,title_primary,synopsis,genres,themes,demographics,studios,producers,source_material,episodes,status,aired_from,aired_to,mal_score,mal_rank,mal_popularity,members_count,retrieved_at,title_english,title_japanese,title_synonyms,title_display
52934,"Konyaku Haki sareta Reijou wo Hirotta Ore ga, Ikenai Koto wo Oshiekomu","On the run for crimes she did not commit, disgraced noblewoman Charlotte Evans collapses deep in the forest. A sorcerer named Allen Crawford—also known as the ""Demon Lord""—finds and defends Charlotte from her pursuers. Since she has no place left to go, Allen takes pity on Charlotte and offers to hire her as a live-in maid.

Allen quickly realizes that Charlotte has faced ridicule and hatred all her life from her so-called noble family, and she has never known what true freedom feels like. He decides to teach her about all the naughty things the world has to offer and enables her to surrender to her whims and impulses. Charlotte's sweet innocence proves an obstacle to his plans, but Allen is determined to show her the kind of life her family has denied her.

Although he despises being social, Allen begins to open himself up to Charlotte. The longer they live together, the more they discover their similarities. Though most people have abandoned them, the duo promises to stay together, oblivious to their budding feelings for each other.

[Written by MAL Rewrite]",['Comedy' 'Fantasy' 'Romance'],[],[],['Zero-G' 'Digital Network Animation'],"['Pony Canyon' 'KlockWorx' 'bilibili' 'Yomiuri TV Enterprise'
 'Aoni Production' 'arma bianca' 'Shufu to Seikatsusha']",Light novel,12.0,Finished Airing,2023-10-04 00:00:00+00:00,2023-12-20T00:00:00+00:00,7.15,3755.0,1904.0,132417.0,2025-11-14T18:53:46.905927+00:00,I'm Giving the Disgraced Noble Lady I Rescued a Crash Course in Naughtiness,婚約破棄された令嬢を拾った俺が、イケナイことを教え込む,['Ikenaikyo'],I'm Giving the Disgraced Noble Lady I Rescued a Crash Course in Naughtiness
53590,Saijaku Tamer wa Gomi Hiroi no Tabi wo Hajimemashita.,"Born into a loving family, Femicia appears to have a bright future ahead of her. When she finally turns five, the time comes to go to the church to have her skills appraised. However, while she does receive a monster tamer skill, it turns out that Femicia has zero stars for that ability. To make matters worse, society considers those who have zero stars to be harbingers of misfortune; as a result, Femicia is shunned by everyone—including her family.

Soon enough, Femicia is chased out of her village and is constantly on the run. Fearing for her life, she decides to masquerade as a boy and change her name to Ivy. With a goal given to her by a fortune teller to reach the royal capital, Ivy meets and successfully tames a slime, starting an unlikely friendship that may provide a means to get the destiny she deserves.

[Written by MAL Rewrite]",['Adventure' 'Fantasy'],['Crossdressing' 'Isekai' 'Reincarnation'],[],['Studio Massket'],"['Lantis' 'Movic' 'KlockWorx' 'Tokyo MX' 'ABC Animation' 'TO Books'
 'NetEase' 'BS Asahi' 'Bandai Namco Music Live' 'ABC Frontier']",Light novel,12.0,Finished Airing,2024-01-12 00:00:00+00:00,2024-03-29T00:00:00+00:00,7.57,1754.0,1910.0,132177.0,2025-11-14T18:53:47.359012+00:00,The Weakest Tamer Began a Journey to Pick Up Trash,最弱テイマーはゴミ拾いの旅を始めました。,[],The Weakest Tamer Began a Journey to Pick Up Trash
56062,Naze Boku no Sekai wo Daremo Oboeteinai no ka?,"In a war against four overpowered races—angels, demons, undeads, and humanoid beasts—humanity could only prevail thanks to its champion Sid, who defeated the other races' champions and sealed away their armies in four pyramids. In an age where Sid's existence has become but a legend of the past, Kai Sakura Vento is one of the many conscripts tasked with monitoring the pyramids in fear that these old foes would escape.

On a peaceful day while spending time with his friend Jeanne E. Anise, the world is suddenly ""overwritten,"" transporting Kai to an alternate reality where humanity has nearly been annihilated by the demons and forced into hiding. To make matters worse, his very existence has been erased from this world; all of his friends, including Jeanne, who leads the local resistance efforts in this world, have forgotten about him.

Trying to investigate the remains of his former world, Kai encounters Rinne, an enigmatic young woman trapped in a pyramid. Mysteriously inheriting Sid's legendary sword Codeholder, Kai manages to free Rinne from her imprisonment. Determined to fix this reality, Kai joins forces with Rinne and Jeanne to free humanity from demonic rule. But if the valiant soldier wants to have a chance at returning to his original world, he will first have to uncover the cause behind the mysterious alteration of reality.

[Written by MAL Rewrite]",['Action' 'Fantasy' 'Sci-Fi'],[],[],['Project No.9'],"['Magic Capsule' 'KlockWorx' 'Asmik Ace' 'Tokyo MX' 'Good Smile Company'
 'Kansai TV' 'Contents Seed' 'Kadokawa' 'Dream Shift' 'Fabtone' 'NetEase'
 'BS Asahi' 'Happinet Phantom Studios' 'Bergamo']",Light novel,12.0,Finished Airing,2024-07-13 00:00:00+00:00,2024-09-28T00:00:00+00:00,6.23,8959.0,1911.0,131994.0,2025-11-14T18:53:48.481873+00:00,Why Does Nobody Remember Me in This World?,なぜ僕の世界を誰も覚えていないのか？,['Why Nobody Remembers My World?' 'NazeBoku'],Why Does Nobody Remember Me in This World?
53407,Bartender: Kami no Glass,"Miwa Kurushima and her colleague Yukari Higuchi hunt for a skilled individual to run the counter bar at the famous Hotel Cardinal. The chairman of the hotel demands only one thing of the potential hire: the bartender must be able to craft the ultimate drink known as the ""Glass of God."" Because Miwa does not fully understand the requirement, her search runs dry after everyone she has scouted cannot get past the chairman's scrutiny.

Nestled in a quiet and secluded place among the bustling alleys of Ginza is Eden Hall. This cozy bar is maintained by Ryuu Sasakura, a prodigy mixologist who knows exactly what drink will ease his customers' worries at any given time. Every glass that he serves is garnished with humility, providing much-needed solace to people from all walks of life in their time of need.

In a chance encounter, the chairman is left speechless by Ryuu's astute bartending skills and is determined to have him join Hotel Cardinal. He becomes one of Ryuu's regulars, attempting daily to convince Ryuu to leave Eden Hall. But even with the assistance of Miwa, it is more difficult than expected to recruit this particular bartender.

[Written by MAL Rewrite]",['Drama' 'Gourmet'],['Adult Cast' 'Workplace'],['Seinen'],['Liber'],['TV Tokyo' 'TOHO animation' 'Crunchyroll' 'NetEase'],Manga,12.0,Finished Airing,2024-04-04 00:00:00+00:00,2024-06-20T00:00:00+00:00,7.38,2527.0,1920.0,131541.0,2025-11-14T18:53:47.191707+00:00,Bartender Glass of God,バーテンダー 神のグラス,[],Bartender Glass of God
55597,Hananoi-kun to Koi no Yamai,"Hotaru Hinase has lived nearly sixteen years without romance. She is satisfied alone as long as she can enjoy the little things in life with her beloved friends and family. In her mind, she is not meant to fall in love, nor does she understand the concept.

While out with a friend, Hotaru witnesses the severe breakup of her schoolmate Hananoi, to whom she has never spoken. Afterward, she sees him sitting in the snow and holds her umbrella over him. To her surprise, this gesture results in him confessing his feelings for her at school the next day. Though Hotaru rejects him, Hananoi insists on letting her get to know him. He does whatever he can to woo her, from changing his hairstyle to finding her lost hairpin in the snow.

Although she has no romantic feelings towards him, Hotaru believes that by spending more time with him, she will learn how to love. She agrees to date him and slowly begins to navigate what being a girlfriend entails, including how to reciprocate the kind gestures that Hananoi continues to perform for her.

[Written by MAL Rewrite]",['Romance'],['School'],['Shoujo'],['East Fish Studio'],['TBS' 'Kodansha' 'Good Smile Company' 'Crunchyroll' 'DMM.com'],Manga,12.0,Finished Airing,2024-04-04 00:00:00+00:00,2024-06-20T00:00:00+00:00,6.76,5764.0,1921.0,131408.0,2025-11-14T18:53:48.205575+00:00,A Condition Called Love,花野井くんと恋の病,"[""I'm Addicted to You.""]",A Condition Called Love
57611,Kimi wa Meido-sama.,"One day, Hitoyoshi Yokoya wakes up to a mysterious nameless girl dressed as a maid ringing his doorbell, asking to be his servant. With her former master referring her to the Yokoya household, she offers her expertise as an assassin. Intimidated by her background, Hitoyoshi tries to send her away; but when she leaves something behind, he rushes to return it to her and is nearly hit by a truck in the process. With her fast reflexes, the girl saves him just in time, and Hitoyoshi ends up taking her in. 

Ironically, the maid lacks any skills apart from the art of killing she has perfected since childhood. Nevertheless, Hitoyoshi welcomes the girl with open arms, encouraging her to leave her monochromatic past behind and experience a normal life. To seal the deal, Hitoyoshi names her Yuki, marking the beginning of her path to redemption and happiness.

[Written by MAL Rewrite]",['Comedy' 'Romance'],[],[],['Felix Film'],"['TV Asahi' 'Shogakukan-Shueisha Productions' 'Ai Addiction'
 'Avex Pictures' 'Shogakukan' 'AbemaTV' 'BS Asahi' 'TV Asahi Music']",Web manga,12.0,Finished Airing,2024-10-06 00:00:00+00:00,2024-12-22T00:00:00+00:00,7.06,4233.0,1922.0,131305.0,2025-11-14T18:53:49.070963+00:00,You are Ms. Servant.,君は冥土様。,[],You are Ms. Servant.
54853,Maou 2099,"Five hundred years ago, the fantasy world of Alneath was torn apart by a war between magically gifted immortals and mortals armed with magical artifacts. The conflict came to an end when mortals' hero, Gram, slayed the Demon Lord Veltol Velvet Velsvolt. In 2099, the world looks a bit different. Alneath and technologically advanced Earth have fused in an event known as Fantasion. Immortals have been hunted down to near extinction, and technological implants called Familia allow mortals to use magic.

As the new world slowly recovers, Veltol's vassal Machina Solege resurrects him in Shinjuku, a techno-magical city constructed in the middle of devastated lands. However, Veltol's magic is severely weakened, and his former ally Marcus has betrayed him. To regain his fame and magical abilities, Veltol follows the advice of Takahashi—Machina's friend and a professional hacker—to start an unusual career: live streaming. His sharp tongue and comically poor gaming skills quickly secure him followers, but to dominate the world once again, Veltol must first uncover Shinjuku's secrets and thwart Marcus' vile plans.

[Written by MAL Rewrite]",['Action' 'Fantasy' 'Sci-Fi'],['Urban Fantasy'],[],['J.C.Staff'],['Aniplex' 'Tokyo MX' 'BS11' 'Kadokawa'],Light novel,12.0,Finished Airing,2024-10-13 00:00:00+00:00,2024-12-29T00:00:00+00:00,7.42,2341.0,1937.0,129598.0,2025-11-14T18:53:47.925415+00:00,Demon Lord 2099,魔王2099,"['Ken to Maou no Cyberpunk'
 'The Lord Of Immortals Blooming in The Abyss F.E. 2099']",Demon Lord 2099
59989,Kami no Tou: Koubou-sen,Second part of Tower of God Season 2.,['Action' 'Adventure' 'Drama' 'Fantasy' 'Mystery'],[],[],['The Answer Studio'],"['Crunchyroll' 'Sola Entertainment' 'Bandai Namco Filmworks'
 'Line Digital Frontier']",Web manga,13.0,Finished Airing,2024-10-06 00:00:00+00:00,2024-12-29T00:00:00+00:00,6.89,5060.0,1941.0,129316.0,2025-11-14T18:53:50.765136+00:00,Tower of God Season 2: Workshop Battle,神之塔 -Tower of God- 工房戦,"['Sin-ui Tap' '신의 탑' 'Kami no Tou 2nd Season'
 'Tower of God: Workshop Battle']",Tower of God Season 2: Workshop Battle
54839,Yoru no Kurage wa Oyogenai,"Mahiru Kouzuki, a skilled artist, gives up on her passion after her elementary school classmates ridicule her colorful jellyfish mural. Several years later, upon encountering an unexpected admirer in Kano Yamanouchi—a former idol with a troubled past—Mahiru decides to pursue her childhood dreams once more.

Tasked with designing the mascot for Kano's new music project, JELEE, Mahiru enlists the help of her childhood friend and professional streamer Kiui Watase to make JELEE's first music video. Together with Kim Anouk Mei Takanashi, a pianist and fan of Kano's work as an idol, the girls aim to turn JELEE into a global hit. However, if they want to succeed in this ambitious endeavor, they will first have to free themselves from the shackles of their pasts.

[Written by MAL Rewrite]",['Drama'],['Music'],[],['Doga Kobo'],"['Movic' 'KlockWorx' 'Asmik Ace' 'Tohokushinsha Film Corporation'
 'King Records' 'Kansai TV' 'BS11']",Original,12.0,Finished Airing,2024-04-07 00:00:00+00:00,2024-06-23T00:00:00+00:00,7.75,1215.0,1948.0,128222.0,2025-11-14T18:53:47.895104+00:00,Jellyfish Can't Swim in the Night,夜のクラゲは泳げない,['Yorukura'],Jellyfish Can't Swim in the Night
54449,Ishura,"After the demise of the demon king, the resulting power vacuum has broken the balance of the world. Eager to claim this power for themselves, self-proclaimed demon kings from various worlds assemble in the New Principality of Lithia to fight for it. Among them, master swordsman Soujirou Yagyuu seeks to take this coveted position for himself. Joined by Tooi Kagizume no Yuno, a young girl he saved from an army of golems that destroyed her city, Soujirou enters Lithia to battle his way to the title.

At the same time, the leaders of the Aureatia Kingdom seek to destabilize Lithia by launching bandits after the convoys of merchandise transiting through the principality. Enraged, Imashime of Taren, the founder of Lithia and defector from Aureatia, sends vicious thief Kasasagi no Dakai to investigate the origin of these attacks. With war on the brink of eruption, no one can predict what influence the contenders for the demon king's throne will have on the coming conflict.

[Written by MAL Rewrite]",['Action' 'Adventure' 'Fantasy'],['Gore' 'Isekai'],[],['Passione'],['Magic Capsule' 'Tencent Japan' 'Kadokawa' 'Aiming'],Light novel,12.0,Finished Airing,2024-01-03 00:00:00+00:00,2024-03-20T00:00:00+00:00,6.72,5961.0,1956.0,127504.0,2025-11-14T18:53:47.680579+00:00,Ishura,異修羅,[],Ishura
60058,[Oshi no Ko] 3rd Season,"The story moves on to a new stage──half a year has passed since the release of ""POP IN 2."" Thanks to Mem-cho's hard work, B-Komachi are on the verge of their big break. Aqua continues to grow as a personality, while Akane advances on her path to becoming a skilled actress. Meanwhile, Kana has lost her usual cheerfulness.

Finally, in her quest to uncover the truth behind Ai and Gorou's deaths, Ruby rises through the entertainment industry—using lies as her weapon.

(Source: Press Release, edited)",['Drama'],['Reincarnation' 'Showbiz'],['Seinen'],['Doga Kobo'],[],Manga,,Not yet aired,2026-01-14 00:00:00+00:00,,,,1956.0,127625.0,2025-11-14T18:53:50.797489+00:00,[Oshi No Ko] Season 3,【推しの子】 第3期,['My Star Season 3'],[Oshi No Ko] Season 3
56894,Dragon Ball Daima,"After saving the world from the destructive might of Majin Buu, Gokuu Son and his allies look forward to a well-earned rest. However, unbeknownst to them, their battle was recorded and observed by Gomah, an evil being who assumes the title of King in the Demon Realm, filling the void left behind with the death of former ruler Dabura.

At Gomah's side is Degesu, the younger brother of Higashi no Kaioshin, a being who lords over the universe. Jealous of his brother's power, Degesu works alongside Gomah to steal Earth's Dragon Balls and preemptively subdue any potential future enemies. Calling upon the power of the legendary dragon Shenron, Gomah wishes for Gokuu and his friends to be reverted into children, intending to rob them of the limitless power that defeated Buu. With Earth's greatest warriors shrunken down, Gomah abducts Dende, the planet's acting god.

But Gokuu refuses to be set back by his new body, working to master his younger form to fight as proficiently as he could as an adult. Joined by Kaioshin and Glorio—a mysterious but seemingly rebellious demon—Gokuu pursues Gomah to the Demon Realm in order to rescue Dende and restore his friends to their natural ages.

[Written by MAL Rewrite]",['Action' 'Adventure' 'Comedy' 'Fantasy'],['Martial Arts'],['Shounen'],['Toei Animation'],[],Manga,20.0,Finished Airing,2024-10-11 00:00:00+00:00,2025-02-28T00:00:00+00:00,7.6,1666.0,1966.0,127016.0,2025-11-14T18:53:48.694308+00:00,Dragon Ball Daima,ドラゴンボール ダイマ,[],Dragon Ball Daima
40682,Kingdom 3rd Season,"Following the successful Sanyou campaign, the Qin army, including 1,000-Man Commander Xin, inches ever closer to fulfilling King Ying Zheng's dream of unifying China. With a major geographical foothold in the state of Wei now under its control, Qin sets its sights eastward toward the remaining warring states.

Meanwhile Li Mu—an unparalleled strategist and the newly appointed prime minister of the state of Zhao—has taken advantage of Zhao's temporary truce with Qin to negotiate with the other states without interruption. Seemingly without warning, Ying Zheng receives news that armies from the states of Chu, Zhao, Wei, Han, Yan, and Qi have crossed into Qin territory. Realizing too late the purpose behind Li Mu's truce with Qin, Zheng quickly gathers his advisors to devise a plan to address the six-state coalition army on their doorstep. For the first time in history, the state of Qin faces complete destruction and must use every resource and strategy at their disposal to prevent themselves from being wiped off the map.

[Written by MAL Rewrite]",['Action'],['Historical' 'Military'],['Seinen'],['Studio Pierrot' 'Studio Signpost'],['Shueisha' 'NHK Enterprises'],Manga,26.0,Finished Airing,2020-04-06 00:00:00+00:00,2021-10-17T00:00:00+00:00,8.83,33.0,1978.0,126115.0,2025-11-14T18:53:43.344289+00:00,Kingdom: Season 3,キングダム 第3シリーズ,[],Kingdom: Season 3
56228,Rekishi ni Nokoru Akujo ni Naru zo,"The kind and compassionate heroine of an otome game may be as flawless as she is admirable, but a certain young woman from Japan much prefers the villainess, Alicia Williams. She sees sense in Alicia's ruthless verbal abuse and values her discipline and fortitude. On the other hand, aside from always toying with Prince Duke Seeker's emotions, the commoner heroine seems to only spout lip service.

Given the choice, the young woman would love to be reincarnated as Alicia—and her wish suddenly comes true! Seven-year-old Alicia awakens with the memories of her past life, now aware of all the future events, outcomes, and the world's secrets. She has no fear; to outsmart the heroine and avoid a bad ending, all Alicia needs is hard work, mastery of her noble family's dark magic, and the determination to become the greatest villainess in history.

[Written by MAL Rewrite]",['Comedy' 'Fantasy' 'Romance'],['Isekai' 'Villainess'],['Shoujo'],['Maho Film'],['Lantis' 'Half H.P Studio' 'Kadokawa' 'Bandai Namco Music Live'],Light novel,13.0,Finished Airing,2024-10-02 00:00:00+00:00,2024-12-25T00:00:00+00:00,7.33,2778.0,1996.0,124472.0,2025-11-14T18:53:48.513266+00:00,I'll Become a Villainess Who Goes Down in History,歴史に残る悪女になるぞ,"['Rekiaku'
 ""I'll Become a Villainess That Will Go Down in History: The More of a Villainess I Become""
 'the More the Prince will Dote on Me']",I'll Become a Villainess Who Goes Down in History
59361,Kono Kaisha ni Suki na Hito ga Imasu,"Coworkers Yui Mitsuya and Masugu Tateishi are the last people anyone would expect to get along—especially with their constant office quarrels. However, looks can be deceiving: they are actually dating! Afraid to lose the peace of their professional lives, Yui and Masugu play up their discord even more to ensure nobody discovers their secret.

As awkward situations and close calls pile up, the risk of Yui and Masugu's coworkers catching on increases. Keeping up the pretense is not easy, but with each new day, their relationship only grows stronger.

[Written by MAL Rewrite]",['Comedy' 'Romance'],['Adult Cast' 'Workplace'],['Seinen'],['Blade'],"['VAP' 'Imagin' 'Nippon Columbia' 'KlockWorx' 'BS Fuji' 'Tokyo MX'
 'bilibili' 'INSPION Edge']",Manga,12.0,Finished Airing,2025-01-06 00:00:00+00:00,2025-03-24T00:00:00+00:00,7.51,1991.0,2020.0,122364.0,2025-11-14T18:53:50.382383+00:00,I Have a Crush at Work,この会社に好きな人がいます,['Can You Keep a Secret?'],I Have a Crush at Work
54703,Fumetsu no Anata e Season 3,Third season of Fumetsu no Anata e.,['Adventure' 'Drama' 'Supernatural'],[],['Shounen'],['Drive' 'Studio Massket'],['Half H.P Studio' 'Crunchyroll' 'NHK Enterprises'],Manga,22.0,Currently Airing,2025-10-04 00:00:00+00:00,,8.02,678.0,2025.0,122075.0,2025-11-14T18:53:47.727578+00:00,To Your Eternity Season 3,不滅のあなたへ Season3,[],To Your Eternity Season 3
58271,Honey Lemon Soda,"First-year high school student Uka Ishimori wants a fresh start. In middle school, Uka was given the nickname ""Rocky"" by her peers, being misunderstood as having no emotions when she was actually shy and introverted. As a result, Uka was relentlessly bullied and experienced a lonely, isolated school life. Now, Uka is determined to change.

During the first week of school, Uka accidentally gets drenched in lemon soda by her classmate Kai Miura—whose cool personality is the complete opposite of hers. After the incident, Uka is surprised when Kai performs small acts of kindness for her, encouraging her to gradually break out of her shell. Like a lemon soda, bubbly and exciting feelings are beginning to stir.

[Written by MAL Rewrite]",['Romance'],['School'],['Shoujo'],['J.C.Staff'],"['Studio Pierrot' 'TMS Entertainment' 'Fuji TV' 'BS Fuji' 'Crunchyroll'
 'Unlimited Produce by TMS']",Manga,12.0,Finished Airing,2025-01-09 00:00:00+00:00,2025-03-27T00:00:00+00:00,7.17,3651.0,2062.0,119323.0,2025-11-14T18:53:49.363834+00:00,Honey Lemon Soda,ハニーレモンソーダ,[],Honey Lemon Soda
58811,Tougen Anki,"Long ago, demon-like creatures known as Oni butchered humans and brought on destruction solely for their own delight. A lone man named Momotarou opposed these gruesome, near-invincible monsters, but the war against them was just beginning.

Thousands of years in the future, temperamental gun enthusiast Shiki Ichinose leads a carefree life. However, after his expulsion from school, everything changes. Shiki is suddenly attacked by a man and is rescued by his adoptive father, Tsuyoshi. As the two flee, Tsuyoshi reveals that Shiki is actually a descendant of the Oni, while both he and their pursuer are from the Momotarou lineage.

The two Momotarou soon clash in a fierce battle, and Tsuyoshi sacrifices himself to protect Shiki. Devastated, Shiki awakens to his Oni blood that grants him immense strength at the cost of going berserk. Although the enemy escapes, Naito Mudano, an Oni teacher at Rasetsu Academy, takes an interest in Shiki. Under Mudano's guidance, Shiki must learn to control the Oni blood—if he ever hopes to avenge his father.

[Written by MAL Rewrite]",['Action' 'Fantasy'],['Mythology'],['Shounen'],['Studio Hibari'],['Dentsu' 'Pony Canyon' 'Nippon Television Network' 'Akita Shoten'],Manga,24.0,Currently Airing,2025-07-11 00:00:00+00:00,2025-12-26T00:00:00+00:00,6.58,6833.0,2071.0,118613.0,2025-11-14T18:53:49.538577+00:00,Tougen Anki,桃源暗鬼,[],Tougen Anki
50738,"Slime Taoshite 300-nen, Shiranai Uchi ni Level Max ni Nattemashita: Sono Ni","Three hundred years ago, the newly reincarnated Azusa Aizawa had resolved to live a slow life forever. At that point, she would have never even thought of reaching level 99 through only killing slimes, let alone becoming the strongest being in the continent. Nevertheless, it is due to her strength and kindness that many girls from different backgrounds—including the dragon Laika, the elf Halkara, the demon queen Pecora, and even the anthropomorphized slime girls Falfa and Shalsha—are all drawn to her. With her ever-growing circle of companions, Azusa's laid-back adventures are far from over—and with even more girls appearing on her doorstep, her already enjoyable life is slated to become even livelier!

[Written by MAL Rewrite]",['Comedy' 'Fantasy'],['CGDCT' 'Isekai'],[],['Teddy'],"['Square Enix' 'Movic' 'AT-X' 'Nippon Columbia' 'KlockWorx' 'Studio Mausu'
 'Bushiroad' 'Hakuhodo DY Music & Pictures' 'Medicos Entertainment' 'BS11'
 'SB Creative']",Light novel,12.0,Finished Airing,2025-04-05 00:00:00+00:00,2025-06-21T00:00:00+00:00,6.68,6188.0,2079.0,118304.0,2025-11-14T18:53:45.490799+00:00,I've Been Killing Slimes for 300 Years and Maxed Out My Level Season 2,スライム倒して300年、知らないうちにレベルMAXになってました ～そのに～,"['Slime Taoshite 300-nen'
 'Shiranai Uchi ni Level Max ni Nattemashita 2nd Season']",I've Been Killing Slimes for 300 Years and Maxed Out My Level Season 2
