anime_id,title_primary,synopsis,genres,themes,demographics,studios,producers,source_material,episodes,status,aired_from,aired_to,mal_score,mal_rank,mal_popularity,members_count,retrieved_at,title_english,title_japanese,title_synonyms,title_display
54865,Blue Lock vs. U-20 Japan,"The next phase of the controversial Blue Lock project is underway with the candidate pool being dwindled down to just 35. Out of the remaining strikers, only a select few will be chosen to play in an upcoming exhibition game against the current U-20 Japanese soccer team. Playing in this match comes with a caveat: winning will grant the players the right to represent the nation as the new U-20 team, but losing will bring an end to Blue Lock in its entirety. Among the ones left in the running is Yoichi Isagi, who is coming to terms with his own abilities.

To further complicate matters, the six best players in the pool have already been named to the starting lineup and the remaining 29 will have to duke it out to claim a coveted spot. Each candidate must select a top six pairing to team up with for the selection to prove their competence. But if this mishmash of strikers wants to overthrow the current U-20 team, they will need to find a way to combine their playstyles effectively.

[Written by MAL Rewrite]",['Sports'],['Team Sports'],['Shounen'],['8bit'],"['TV Asahi' 'Lantis' 'Kodansha' ""Toy's Factory"" 'Crunchyroll' 'Chiptune'
 'Bandai Spirits' 'Bit grooove promotion' 'Bandai Namco Filmworks'
 'Bandai Namco Music Live']",Manga,14.0,Finished Airing,2024-10-06 00:00:00+00:00,2024-12-28T00:00:00+00:00,7.54,1897.0,888.0,308773.0,2025-11-14T18:53:47.980384+00:00,Blue Lock Season 2,ブルーロック VS. U-20 JAPAN,['Blue Lock 2nd Season'],Blue Lock Season 2
54714,Kimi no Koto ga Daidaidaidaidaisuki na 100-nin no Kanojo,"Rentarou Aijou has it all: looks, intelligence, athletic skill, and popularity with peers and mentors alike. Unfortunately, none of these qualities help Rentarou with his love life. On the day of his middle school graduation, he is once again turned down by a girl he confesses to, earning his one-hundredth rejection in a row. Down on his luck, he goes to a matchmaking shrine and wishes to finally get a girlfriend in high school.

When the god of the shrine suddenly appears before him, Rentarou is told he will meet an astronomical total of one hundred soulmates in high school. Though Rentarou initially does not take this foretelling seriously, his doubts disappear when, on the first day of school, he meets two of these soulmates—Hakari Hanazono and Karane Inda—who both confess to him. With fated encounters and love confessions galore, Rentarou's life is about to get a lot more exciting.

[Written by MAL Rewrite]",['Comedy' 'Romance'],['Harem' 'Parody' 'School'],['Seinen'],['Bibury Animation Studios'],"['Lantis' 'Movic' 'Bushiroad' 'Tokyo MX' 'Shueisha' 'NetEase'
 'Bushiroad Move' 'Bandai Namco Filmworks' 'Bandai Namco Music Live']",Manga,12.0,Finished Airing,2023-10-08 00:00:00+00:00,2023-12-24T00:00:00+00:00,7.69,1374.0,890.0,308224.0,2025-11-14T18:53:47.744800+00:00,"The 100 Girlfriends Who Really, Really, Really, Really, Really Love You",君のことが大大大大大好きな100人の彼女,['Hyakkano'],"The 100 Girlfriends Who Really, Really, Really, Really, Really Love You"
59177,Kaijuu 8-gou 2nd Season,"Following the massive operation that led to the confinement of recent recruit Kafka Hibino, otherwise known as Kaijuu No. 8, the Defense Force has been puzzled by how to deal with him. Kafka is the first kaijuu to side with humans, and after careful consideration, he is eventually transferred to the Defense Force's First Division in the hope of adding his power to the strongest division, capable of handling any threat. However, some people are still doubtful about Kafka, and he must prove his worth in the next mission.

Kafka and the First Division are soon dispatched when a massive horde of ant-like kaijuu begins wreaking havoc. Thanks to the combined strength of Kafka's friend Kikoru Shinomiya and their captain, Gen Narumi, the mission seems to progress as it should. However, when Kafka fails to transform into his kaijuu form, the dreadful Kaijuu No. 9 joins the battle with only one goal—to eliminate him and steal his power. Although the situation is looking grim, Kafka must overcome his most difficult trial yet with the others if he wants to keep pursuing his dream: fighting side by side with his childhood friend and Third Division captain, Mina Ashiro.

[Written by MAL Rewrite]",['Action' 'Fantasy' 'Sci-Fi'],['Adult Cast' 'Military' 'Urban Fantasy'],['Shounen'],['Production I.G'],"['TV Tokyo' 'Khara' 'Nippon Columbia' 'TOHO animation' 'Shueisha'
 'Sonilude' 'Toho Music']",Manga,11.0,Finished Airing,2025-07-19 00:00:00+00:00,2025-09-27T00:00:00+00:00,7.8,1090.0,894.0,307649.0,2025-11-14T18:53:50.090484+00:00,Kaiju No. 8 Season 2,怪獣8号 第2期,['8Kaijuu' 'Monster #8' 'Kaiju No. Eight' 'Kaiju #8'],Kaiju No. 8 Season 2
57524,Make Heroine ga Oosugiru!,"Despite not understanding much about fleeting teen romance, first-year high school student Kazuhiko Nukumizu still wonders how he would react if his life were to be turned into a love story. Regardless, as a self-proclaimed ""background character,"" Nukumizu is satisfied continuing his life as an introvert with a negligible social life. However, he suddenly finds himself too close to the spotlight when he witnesses his popular classmate Anna Yanami be rejected by her childhood friend in the middle of a family restaurant. 

While Nukumizu wishes he could just forget what he saw and move on, Anna ends up forcefully confiding herself in Nukumizu, lamenting her status as a childhood friend fated to have her beloved stolen. As he becomes dragged into Anna's situation, Nukumizu soon gets caught up in the relationship drama of two more girls: Lemon Yakishio, an outgoing member of the track and field club; and Chika Komari, a shy member of the literature club. Now thrust out of his comfort zone, Nukumizu finds himself a major character in the lives of too many losing heroines. 

[Written by MAL Rewrite]",['Comedy' 'Romance'],['School'],[],['A-1 Pictures'],"['Aniplex' 'Yomiuri Telecasting' 'Tokyo MX' 'Good Smile Company' 'BS11'
 'Contents Seed' 'INSPION Edge' 'JR Tokai Agency']",Light novel,12.0,Finished Airing,2024-07-14 00:00:00+00:00,2024-09-29T00:00:00+00:00,8.1,553.0,899.0,304232.0,2025-11-14T18:53:49.007579+00:00,Makeine: Too Many Losing Heroines!,負けヒロインが多すぎる！,['Makeine'],Makeine: Too Many Losing Heroines!
49613,Chiyu Mahou no Machigatta Tsukaikata,"Ken Usato, an ordinary high schooler, wishes for something fantastical to occur in his unremarkable life. Such an opportunity arrives when he is transported to another world alongside Kazuki Ryuusen and Suzune Inukami, two prodigious members of his school's student council. Arriving in Llinger Kingdom, the three are deemed to be the heroes tasked with stopping the impending invasion by the Demon Lord's army. However, this is a misunderstanding—Usato was summoned by accident and, unlike his two friends, is not one of the heroes.

Despite this disheartening revelation, Usato learns that he has an aptitude for the extremely rare healing magic. This catches the attention of Rose, the intimidating captain of the kingdom's Rescue Team, who forcibly takes custody of Usato to mold him into a full-fledged healer. As he undergoes grueling training under Rose's supervision, Usato resolves to become capable enough to protect his friends from the dangers of this world.

[Written by MAL Rewrite]",['Action' 'Adventure' 'Fantasy'],['Isekai'],[],['Shin-Ei Animation' 'Studio Add'],"['Frontier Works' 'Lantis' 'Half H.P Studio' 'Crunchyroll'
 'GREE Entertainment' 'Bandai Namco Music Live' 'Capibara']",Light novel,13.0,Finished Airing,2024-01-06 00:00:00+00:00,2024-03-30T00:00:00+00:00,7.53,1911.0,906.0,301092.0,2025-11-14T18:53:44.736373+00:00,The Wrong Way to Use Healing Magic,治癒魔法の間違った使い方,[],The Wrong Way to Use Healing Magic
57181,Ao no Hako,"Every morning, incoming first-year Taiki Inomata hurries to his high school gym in order to further refine his badminton skills. However, his true motivation stems from sharing the otherwise empty gym with second-year Chinatsu Kano, Taiki's crush and the star player of the girls' basketball team. Although Chinatsu seems unapproachable, Taiki gradually finds opportunities to get to know her little by little.

Unbeknownst to Taiki, his tireless work ethic and admiration motivate Chinatsu to work harder and strive to achieve her greatest ambitions. When her family must suddenly move overseas for work, Chinatsu decides to remain in Japan and shoot for victory at the national level. With nowhere to stay, she is taken in by Taiki's mother, who is longtime friends with Chinatsu's own. Overwhelmed with the new reality of living alongside the girl he loves, Taiki resolves to join Chinatsu at the national level in his own sport—and grow closer to her in the process.

Still, despite being good enough to catch his coach's eye, Taiki must fight an uphill battle to qualify for a spot on the starting team. Cheered on by both Chinatsu and gymnast Hina Chouno, his childhood friend, Taiki aims to make a name for himself among his powerful upperclassmen.

[Written by MAL Rewrite]",['Romance' 'Sports'],['Love Polygon' 'School' 'Team Sports'],['Shounen'],['Telecom Animation Film'],"['TBS' 'Magic Capsule' 'TOHO animation' 'Shueisha' 'TMS Music'
 'Unlimited Produce by TMS']",Manga,25.0,Finished Airing,2024-10-03 00:00:00+00:00,2025-03-27T00:00:00+00:00,8.18,438.0,922.0,293843.0,2025-11-14T18:53:48.805813+00:00,Blue Box,アオのハコ,[],Blue Box
55690,Boku no Kokoro no Yabai Yatsu 2nd Season,"After an eventful winter break, Kyoutarou Ichikawa and Anna Yamada reunite with a stronger bond. They continue to grow in their own ways, with Yamada taking on more challenging photoshoots and Ichikawa maturing both physically and emotionally as he tackles his affections for Yamada. However, spending time together outside of school allows for their relationship to deepen, and it becomes increasingly difficult to deny their budding romantic feelings.

Grappling with these unexpected and new emotions, Ichikawa and Yamada realize that, with the passage of time, their relationship is bound to change—and they must ultimately decide whether they wish to remain close friends or finally become a couple.

[Written by MAL Rewrite]",['Comedy' 'Romance'],['School'],['Shounen'],['Shin-Ei Animation'],"['Dentsu' 'TV Asahi' 'Movic' 'Magic Capsule' 'Avex Pictures'
 'Akita Shoten' 'BS Asahi' 'TV Asahi Music']",Manga,13.0,Finished Airing,2024-01-07 00:00:00+00:00,2024-03-31T00:00:00+00:00,8.72,57.0,945.0,285534.0,2025-11-14T18:53:48.238094+00:00,The Dangers in My Heart Season 2,僕の心のヤバイやつ 第2期,['Bokuyaba'],The Dangers in My Heart Season 2
59192,Kimetsu no Yaiba Movie 1: Mugenjou-hen - Akaza Sairai,First anime movie of the trilogy adaptation of the Infinity Castle Arc.,['Action' 'Supernatural'],['Historical'],['Shounen'],['ufotable'],['Aniplex' 'Shueisha'],Manga,1.0,Finished Airing,2025-07-18 00:00:00+00:00,,8.71,62.0,947.0,285548.0,2025-11-14T18:53:50.129024+00:00,Demon Slayer: Kimetsu no Yaiba - The Movie: Infinity Castle - Part 1: Akaza Returns,劇場版 鬼滅の刃 無限城編 第一章 猗窩座再来,[],Demon Slayer: Kimetsu no Yaiba - The Movie: Infinity Castle - Part 1: Akaza Returns
50307,Tonikaku Kawaii 2nd Season,"In the wake of their first home burning down, Nasa and Tsukasa Yuzaki are seeking temporary shelter at the Arisugawas' bathhouse. Though they have only been married for a short time, their relationship has only become sweeter by the day. Nasa is determined to spend as much time with his wife as possible, basking in the happiness of their marriage.

The newlyweds find new ways to explore their relationship. From adopting a cat, going to an amusement park, and even watching an impromptu romantic comedy featuring Nasa's former teacher, every day is a new experience. But while Tsukasa continues to meet the people in Nasa's life, Nasa has yet to meet more of Tsukasa's family. Though they appear to be the picture-perfect couple to everyone around them, Nasa begins to wonder if he will ever learn more about his wife's mysterious past.

[Written by MAL Rewrite]",['Comedy' 'Romance'],[],['Shounen'],['Seven Arcs'],"['Shogakukan-Shueisha Productions' 'Warner Bros. Japan' 'KlockWorx'
 'Shogakukan' 'Crunchyroll']",Manga,12.0,Finished Airing,2023-04-08 00:00:00+00:00,2023-06-24T00:00:00+00:00,7.63,1553.0,953.0,283363.0,2025-11-14T18:53:45.173259+00:00,Tonikawa: Over The Moon For You Season 2,トニカクカワイイ,[],Tonikawa: Over The Moon For You Season 2
53111,Dungeon ni Deai wo Motomeru no wa Machigatteiru Darou ka IV: Shin Shou - Yakusai-hen,Second part of Dungeon ni Deai wo Motomeru no wa Machigatteiru Darou ka IV.,['Action' 'Adventure' 'Fantasy'],[],[],['J.C.Staff'],"['Genco' 'Movic' 'Warner Bros. Japan' 'KlockWorx'
 'Hakuhodo DY Music & Pictures' 'Egg Firm' 'FuRyu' 'GREE' 'SB Creative']",Light novel,11.0,Finished Airing,2023-01-07 00:00:00+00:00,2023-03-18T00:00:00+00:00,8.25,354.0,962.0,280564.0,2025-11-14T18:53:47.062246+00:00,Is It Wrong to Try to Pick Up Girls in a Dungeon? IV Part 2,ダンジョンに出会いを求めるのは間違っているだろうかⅣ深章 厄災篇,"['DanMachi 4th Season Part 2'
 'Is It Wrong That I Want to Meet You in a Dungeon 4th Season Part 2']",Is It Wrong to Try to Pick Up Girls in a Dungeon? IV Part 2
52635,Kami no Tou: Ouji no Kikan,"On the 20th floor of the Tower, the ""Regulars"" who have been permitted to enter have to undertake arduous and extremely expensive tests to rank up. Most abandon hope and choose to stay where they are—but not Ja Wangnan.

Wangnan is determined to reach the top and become the king of the Tower. However, he is weak and has repeatedly failed the exam, with debt collectors tailing him. In desperation, he attempts the exam one more time, only to encounter a mysterious and powerful individual: Jyu Viole Grace, a member of the crime syndicate FUG.

Cursing his rotten luck, Wangnan has no choice but to form alliances with strong people, including Viole—who still refuses to be part of any team. Amid a dire situation, Wangnan must find a way to change Viole's mind to finally advance past the 20th floor, or he will never get a chance to build his legacy.

[Written by MAL Rewrite]",['Action' 'Adventure' 'Drama' 'Fantasy' 'Mystery'],[],[],['The Answer Studio'],"['Crunchyroll' 'Sola Entertainment' 'Bandai Namco Filmworks'
 'Line Digital Frontier']",Web manga,13.0,Finished Airing,2024-07-07 00:00:00+00:00,2024-09-29T00:00:00+00:00,6.67,6265.0,972.0,278887.0,2025-11-14T18:53:46.729489+00:00,Tower of God Season 2: Return of the Prince,神之塔 -Tower of God- 王子の帰還,"['Sin-ui Tap' '신의 탑' 'Tower of God: Return of the Prince'
 'Kami no Tou 2nd Season']",Tower of God Season 2: Return of the Prince
53613,Dead Mount Death Play,"A powerful necromancer known as the Corpse God dies during a legendary battle, only to be reborn as Polka Shinoyama, a young boy in modern-day Tokyo. In the process of trying to adapt to his new physical body, he gets targeted by various groups that deal with the supernatural. Among them is Misaki Sakimiya, a high school girl who can see spirits and is out for his blood from the very moment they meet.

Attempting to make sense of this situation where unknown parties want him dead, Polka eventually meets Takumi Kuruya, a contractor skilled in surveillance and hacking, and Lisa Kuraki, a crime boss operating out of Shinjuku. Alongside these—and other unexpected—allies, Polka braves danger to reveal the truth of his reincarnation and the fate awaiting the world he now lives in.

[Written by MAL Rewrite]",['Action' 'Fantasy'],['Reincarnation' 'Urban Fantasy'],['Seinen'],['Geek Toys'],"['Square Enix' 'Movic' 'Half H.P Studio' 'F.M.F' 'King Records'
 'Crunchyroll' 'Kadokawa Media House' 'Geek Pictures']",Manga,12.0,Finished Airing,2023-04-11 00:00:00+00:00,2023-06-27T00:00:00+00:00,7.26,3130.0,978.0,276415.0,2025-11-14T18:53:47.375907+00:00,Dead Mount Death Play,デッドマウント・デスプレイ,[],Dead Mount Death Play
51818,Enen no Shouboutai: San no Shou,"After undergoing Benimaru Shinmon's hellish training, Shinra Kusakabe and Arthur Boyle return to Special Fire Force Company 8. However, there is no time to rest: Captain Akitaru Oubi is arrested by the military police under the influence of the White-Clad cult. Moreover, the White-Clad member Haumea—one of the eight pillars who possess Adolla Burst—has successfully brainwashed the leadership of the Tokyo Empire and infiltrated the heart of the firefighting organization. As a result, Shinra and the rest of the Company 8 squad are branded as rebels after they launch a rescue mission to save their captain and ultimately liberate Tokyo.

[Written by MAL Rewrite]",['Action' 'Fantasy' 'Sci-Fi'],['Urban Fantasy'],['Shounen'],['David Production'],"['Mainichi Broadcasting System' 'Kodansha' 'Crunchyroll' 'DMM.com'
 'ADK Marketing Solutions' 'Sankyo']",Manga,12.0,Finished Airing,2025-04-05 00:00:00+00:00,2025-06-21T00:00:00+00:00,7.7,1352.0,978.0,276560.0,2025-11-14T18:53:46.227961+00:00,Fire Force Season 3,炎炎ノ消防隊 参ノ章,['Enen no Shouboutai 3rd Season'],Fire Force Season 3
51462,Isekai Nonbiri Nouka,"During the final years of his life, Hiraku Machio remained confined to a hospital bed with a terminal illness until he finally passed away. Taking pity on the unfair life he lived, a god decides to reincarnate Hiraku in another world where he can live as he pleases. Wanting to try farming in this new life, he is bestowed with an all-in-one ""Almighty Farming Tool"" that can transform into any useful implement he wishes. Hiraku is then transported to a forest seemingly far from civilization. Here, he plans to build and farm everything from scratch—gradually developing the lifeless area into a thriving new society.

[Written by MAL Rewrite]",['Fantasy' 'Slice of Life'],['Isekai'],[],['Zero-G'],['MediaNet' 'Pony Canyon' 'AT-X' 'Hakuhodo' 'Kadokawa' 'Saber Links'],Light novel,12.0,Finished Airing,2023-01-06 00:00:00+00:00,2023-03-24T00:00:00+00:00,7.53,1922.0,1001.0,271121.0,2025-11-14T18:53:45.860497+00:00,Farming Life in Another World,異世界のんびり農家,[],Farming Life in Another World
57592,Dr. Stone: Science Future,"Having resolved the crisis in the Petrification Kingdom, Senkuu and his companions gear up to deal directly with the mastermind behind the petrification phenomenon—who supposedly resides on the moon. The ambitious spaceship project, however, requires immense manpower and critical resources scattered across the world. Thus, the Kingdom of Science exploration team kick-starts its transcontinental journey on the ship Perseus to gather them all.

Equipped with modern technology and bolstered by the new, capable members in their ranks, the exploration team feels confident about setting sail to their first destination: America. They soon realize that the region now hosts adversaries controlling the resources they need, doing so with scientific technology which rivals and even exceeds their own. In a battle of science versus science, Senkuu and his team must outsmart their rivals if they are to have any chance of ensuring the continued survival and rejuvenation of humanity.

[Written by MAL Rewrite]",['Adventure' 'Comedy' 'Sci-Fi'],[],['Shounen'],['TMS Entertainment'],['TOHO animation' 'Shueisha'],Manga,12.0,Finished Airing,2025-01-09 00:00:00+00:00,2025-03-27T00:00:00+00:00,8.25,353.0,1015.0,268714.0,2025-11-14T18:53:49.055897+00:00,Dr. Stone: Science Future,Dr.STONE SCIENCE FUTURE,['Dr. Stone 4th Season'],Dr. Stone: Science Future
41514,Itai no wa Iya nanode Bougyoryoku ni Kyokufuri Shitai to Omoimasu. 2,"After achieving fruitful results in New World Online's previous events, the now famous Maple Tree guild is excited to explore the new floors introduced in game. As if their guild was not already feared enough, each member is motivated to find stronger skills for themselves in order to greatly expand their options in future battles. Not forgetting the importance of networking, the guild also forges amicable relationships with other notable guilds, such as the Kingdom of the Flame Emperor and the Congregation of the Holy Swords.

With their eccentric guild master Maple at the forefront, the members of Maple Tree continue to stumble upon creative ways to implement their skills, driving the game developers crazy along the way.

[Written by MAL Rewrite]",['Action' 'Adventure' 'Comedy' 'Fantasy'],['Video Game'],[],['SILVER LINK.'],"['MAGES.' 'Docomo Anime Store' 'Sammy' 'ABC Animation'
 'Kadokawa Media House' 'Kadokawa' 'D-techno']",Light novel,12.0,Finished Airing,2023-01-11 00:00:00+00:00,2023-04-20T00:00:00+00:00,7.22,3386.0,1025.0,265793.0,2025-11-14T18:53:43.490753+00:00,"BOFURI: I Don't Want to Get Hurt, so I'll Max Out My Defense. Season 2",痛いのは嫌なので防御力に極振りしたいと思います。2,"[""BOFURI: I Don't Want to Get Hurt""
 ""so I'll Max Out My Defense 2nd Season"" 'I hate being in pain'
 ""so I think I'll make a full defense build 2"" 'I Hate Getting Hurt'
 'So I Put All My Skill Points Into Defense 2']","BOFURI: I Don't Want to Get Hurt, so I'll Max Out My Defense. Season 2"
51297,Ragna Crimson,"Said to be humanity's natural enemy, formidable dragons that belong to an ancient bloodline roam the world. Only two ways prove effective to kill a dragon: freezing their blood with silverine—an aura that comes from silver weapons—or letting their bodies be incinerated by sunlight.

Young hunter prodigy Leonica is accompanied by her close friend Ragna, who appears to lack the skills necessary in their profession. Moreover, many shun Ragna, considering him cursed because dragons always seem to attack him and slaughter his close ones. Nevertheless, Leonica sees potential in Ragna and gladly partners up with him. Likewise, Ragna feels certain that Leonica is immune to his misfortune thanks to her incredible strength.

His confidence is shaken, however, when Ragna dreams of Leonica's death, believing this to be a prophecy. As the destined day arrives, he comes face-to-face with his future self, who bestows him enormous power and memories from the future to ensure Leonica's safety. In order to succeed, Ragna must join forces with a mysterious figure known as Crimson and eradicate all dragons for good.

[Written by MAL Rewrite]",['Action' 'Fantasy'],[],['Shounen'],['SILVER LINK.'],"['Square Enix' 'Mainichi Broadcasting System' 'Movic' 'King Records'
 'BS11' 'NewGin' 'GREE Entertainment']",Manga,24.0,Finished Airing,2023-10-01 00:00:00+00:00,2024-03-31T00:00:00+00:00,7.55,1873.0,1027.0,264687.0,2025-11-14T18:53:45.834366+00:00,,ラグナクリムゾン,[],Ragna Crimson
56784,Bleach: Sennen Kessen-hen - Soukoku-tan,"After an awe-inspiring battle with Ichibei Hyousube—leader of the Soul Society's Royal Guard—the powerful Yhwach moves into the final stage of his master plan. He aims to slay the Soul King, the being whose very existence maintains the status quo of three worlds: Hueco Mundo, the Soul Society, and the realm of humans that Ichigo Kurosaki and his closest friends hail from. Conquering his own bout with the remainder of the Royal Guard, Uryuu Ishida joins Yhwach in his efforts to create a new world in his image.

With a flood of resolution and newfound power, Ichigo rushes to stop Yhwach from accomplishing his ultimate goal and save the countless lives within the three existing realms. But Ichigo has a complicated lineage, one that leaves him susceptible to Yhwach's sinister influence.

Meanwhile, in a final desperate gambit, Jirou Sakuranosuke Shunsui Kyouraku, the newly promoted head captain of the Soul Society's combat corps, enlists the help of an old enemy whose immense power may turn the tide of battle.

[Written by MAL Rewrite]",['Action' 'Adventure' 'Supernatural'],[],['Shounen'],['Pierrot Films'],"['Studio Pierrot' 'TV Tokyo' 'Aniplex' 'Dentsu' 'Shueisha'
 'Zack Promotion']",Manga,14.0,Finished Airing,2024-10-05 00:00:00+00:00,2024-12-28T00:00:00+00:00,8.67,75.0,1028.0,264701.0,2025-11-14T18:53:48.642577+00:00,Bleach: Thousand-Year Blood War - The Conflict,BLEACH 千年血戦篇-相剋譚-,['Bleach: Thousand-Year Blood War Arc Part 3'],Bleach: Thousand-Year Blood War - The Conflict
