anime_id,title_primary,synopsis,genres,themes,demographics,studios,producers,source_material,episodes,status,aired_from,aired_to,mal_score,mal_rank,mal_popularity,members_count,retrieved_at,title_english,title_japanese,title_synonyms,title_display
44204,Kyokou Suiri Season 2,"During a blizzard, Masayuki Muroi's old high school friend pushes him off a mountain to certain death. However, Masayuki survives the fall and escapes to safety thanks to Yuki-Onna, the spirit of a beautiful young woman who is said to lead men to their demise—but all she asks in return is money.

Eleven years later, Masayuki has lived a successful life, having gotten married and amassing a great fortune. But when his company collapses and his wife cheats on him, Masayuki retreats to the city where Yuki-Onna once saved him, and he reconnects with her by offering her money and tasty meals. While Masayuki recovers from his misfortunes, another one knocks on his door: his ex-wife is found beaten to death, and now only Yuki-Onna—who cannot reveal herself—can corroborate his alibi.

With no one to turn to, Yuki-Onna enlists the help of the spirits' God of Wisdom, Kotoko Iwanaga. Revered by the various spirits that wander the earth, Kotoko uses her extraordinary wits and cunning to solve all quarrels they may have. In her duty to protect spirits and humans from colliding, Kotoko drags along her immortal boyfriend, Kurou Sakuragawa, and promises to prove Masayuki's innocence without exposing Yuki-Onna's existence.

[Written by MAL Rewrite]",['Mystery' 'Romance' 'Supernatural'],['Adult Cast' 'Mythology'],['Shounen'],"[""Brain's Base""]","['Nihon Ad Systems' 'Kodansha' 'KlockWorx' 'Docomo Anime Store'
 'King Records' 'Crunchyroll' 'BS NTV' 'Mixi' 'Studio Tenjin']",Manga,12.0,Finished Airing,2023-01-09 00:00:00+00:00,2023-03-27T00:00:00+00:00,7.35,2678.0,1464.0,182495.0,2025-11-14T18:53:43.865071+00:00,In/Spectre 2,虚構推理 Season2,['In/Spectre 2nd Season' 'Kyokou Suiri 2nd Season'],In/Spectre 2
59597,Witch Watch,"In ancient times, some witches married their familiars, who had taken human form, giving birth to a lineage of ogres. One such ogre is Morihito Otogi, who while appearing completely human, still retains the inhuman strength of his bloodline. Nico Wakatsuki is a young witch and Morihito's childhood friend, but as part of her education, she had to go to the Witches' Holy Land to train and part ways with Morihito.

Years later, just before Morihito's first year of high school, Nico returns home with one goal in mind: to claim him as her familiar. While most witches choose a cat or a bat, Nico has her heart set on Morihito in more ways than one. Although seemingly oblivious to her true feelings, Morihito and Nico end up living together under the same roof with both of Morihito's parents elsewhere. While reluctant at first, Morihito accepts his new role, determined to help Nico seamlessly fit back in with human society and protect her from fated disaster. 

[Written by MAL Rewrite]",['Comedy' 'Fantasy'],['Urban Fantasy'],['Shounen'],['Bibury Animation Studios'],"['Shogakukan-Shueisha Productions' 'Shochiku'
 'Mainichi Broadcasting System' 'Movic' 'Shueisha'
 'JR East Marketing & Communications' 'Myrica Music' 'AQUA ARIS'
 'Bit grooove promotion']",Manga,25.0,Finished Airing,2025-04-06 00:00:00+00:00,2025-10-05T00:00:00+00:00,7.39,2504.0,1469.0,181322.0,2025-11-14T18:53:50.557540+00:00,Witch Watch,ウィッチウォッチ,[],Witch Watch
50582,Nanatsu no Maken ga Shihai suru,"Impressed by Nanao Hibiya's skill with a sword, Kimberly Magic Academy instructor Theodore McFarlane saves the samurai from certain death amid a fierce battle. With his encouragement, Nanao enrolls in the academy, where she instantly becomes a celebrity after she and four of her peers save a student from an enraged troll. Under the leadership of Oliver Horn, a young man who seems to hide a troubled past, Nanao and her newfound friends start their magical apprenticeship at Kimberly—where only four out of five students make it to graduation in one piece.

It does not take long for Oliver and his friends to experience the dangers of the academy firsthand, as a near-death encounter in the labyrinth under the school leaves Nanao grappling with her bloody past. The inexperienced yet determined students must stick together if they want to have a chance to survive and uncover the mysteries that the academy holds.

[Written by MAL Rewrite]",['Action' 'Fantasy'],['School'],[],['J.C.Staff'],"['Sotsu' 'Lantis' 'Movic' 'Magic Capsule' 'Warner Bros. Japan' 'KlockWorx'
 'Tokyo MX' 'BS11' 'Konami Digital Entertainment' 'Kadokawa'
 'Bandai Namco Music Live']",Light novel,15.0,Finished Airing,2023-07-08 00:00:00+00:00,2023-10-14T00:00:00+00:00,6.56,6973.0,1472.0,181051.0,2025-11-14T18:53:45.293169+00:00,Reign of the Seven Spellblades,七つの魔剣が支配する,['Nanatsuma'],Reign of the Seven Spellblades
52446,Kaiko sareta Ankoku Heishi (30-dai) no Slow na Second Life,"For more than 30 years, Dariel has been a loyal soldier in the Demon King's army, having been raised by Granbarza, one of the Four Heavenly Generals. However, as Dariel lacks any magical potential, he is nothing but a disgrace in the eyes of Granbarza's son, Bashbarza, who fires Dariel right after assuming his father's position as a general.

Stripped of a home and a job, Dariel wanders the forests, where he stumbles upon a human girl named Malika running from a monster. After Dariel intervenes to help Malika, she invites him to stay at her village in return. There, he discovers that the reason he has zero suitability for magic as a demon is that he is, in fact, a human.

However, Dariel is no ordinary human. Possessing potential that far outweighs even heroes, Dariel may soon find himself involved in the humans and demons' seemingly never-ending conflict, facing against the race he once considered allies.

[Written by MAL Rewrite]",['Comedy' 'Fantasy'],[],[],['Encourage Films'],"['Pony Canyon' 'Kodansha' 'bilibili' 'Good Smile Film'
 'Bit grooove promotion']",Light novel,12.0,Finished Airing,2023-01-07 00:00:00+00:00,2023-03-25T00:00:00+00:00,7.0,4529.0,1473.0,181021.0,2025-11-14T18:53:46.609524+00:00,Chillin' in My 30s after Getting Fired from the Demon King's Army,解雇された暗黒兵士（30代）のスローなセカンドライフ,[],Chillin' in My 30s after Getting Fired from the Demon King's Army
52816,Majo to Yajuu,"Cursed by a witch, the feral and tempestuous Guideau tenaciously searches for the culprit so she can exact revenge. To this end, she joins the Order of Magical Resonance, an organization that deals with everything connected to magic. The Order agrees to work with Guideau in return for her help solving the myriad of magic-related cases occurring across the world.

The Order's suave and mysterious mage Ashaf accompanies Guideau for the sake of successfully completing missions. As the pair traverses the land in search of that unknown witch, their experience with the fantastical world of magic grows ever more peculiar the further they advance in their journey.

[Written by MAL Rewrite]",['Action' 'Fantasy'],['Adult Cast' 'Gore'],['Seinen'],['Yokohama Animation Lab'],"['TBS' 'Kodansha' 'DAX Production' 'NBCUniversal Entertainment Japan'
 'BS11' 'Crunchyroll' 'Nichion' 'MAGNET']",Manga,12.0,Finished Airing,2024-01-12 00:00:00+00:00,2024-04-05T00:00:00+00:00,7.44,2277.0,1480.0,180568.0,2025-11-14T18:53:46.870558+00:00,The Witch and the Beast,魔女と野獣,['Witch and the Beast'],The Witch and the Beast
57433,Seishun Buta Yarou wa Santa Claus no Yume wo Minai,"After surviving the entrance exams, Sakuta Azusagawa has finally enrolled in the same university as his girlfriend, Mai Sakurajima. He is gradually getting used to the unfamiliar environment as he attends student gatherings and makes new acquaintances. Everything seems to be going smoothly until Sakuta's friend and Sweet Bullet idol group member Uzuki Hirokawa begins acting out.

With fellow Sweet Bullet member Nodoka Toyohama pleading for his help, Sakuta realizes that he has stumbled upon another case of the inexplicable Puberty Syndrome—Uzuki is feeling pressured by the sudden surge of popularity and rumors of a potential solo career. While Sakuta searches for a solution, another occurrence of Puberty Syndrome gradually emerges from the shadows.

[Written by MAL Rewrite]",['Drama' 'Romance' 'Supernatural'],['School'],[],['CloverWorks'],"['Aniplex' 'Half H.P Studio' 'Tokyo MX' 'Nagoya Broadcasting Network'
 'BS11' 'ABC Animation' 'Kadokawa']",Light novel,13.0,Finished Airing,2025-07-05 00:00:00+00:00,2025-09-27T00:00:00+00:00,8.18,444.0,1491.0,179655.0,2025-11-14T18:53:48.991425+00:00,Rascal Does Not Dream of Santa Claus,青春ブタ野郎はサンタクロースの夢を見ない,['Seishun Buta Yarou: Daigakusei-hen'],Rascal Does Not Dream of Santa Claus
53730,"Sokushi Cheat ga Saikyou sugite, Isekai no Yatsura ga Marude Aite ni Naranai n desu ga.","During a school trip, a bus full of students is suddenly transported to another world by a sage named Sion. She bestows most of the students with powers called Gifts, seeking to recruit them to become sages as well. However, a few are excluded from receiving a Gift, resulting in the others leaving them behind.

Yogiri Takatou, one of the students who did not receive a Gift, wakes up to find a dragon attacking the bus. Amidst the chaos, he executes the dragon using his innate ability to instantly put anything to death. Alongside fellow survivor Tomochika Dannoura, Takatou sets out to find a way back to Earth, all while eliminating anyone who dares to underestimate him—including his former classmates.

[Written by MAL Rewrite]",['Action' 'Adventure' 'Comedy' 'Fantasy'],['Isekai' 'Parody'],[],['Okuruto Noboru'],"['Mainichi Broadcasting System' 'KlockWorx' 'Earth Star Entertainment'
 'Tokyo MX' 'BS11' 'JR East Marketing & Communications' 'Nichion' 'MAGNET'
 'AQUA ARIS']",Light novel,12.0,Finished Airing,2024-01-05 00:00:00+00:00,2024-03-22T00:00:00+00:00,6.36,8177.0,1493.0,179484.0,2025-11-14T18:53:47.408991+00:00,"My Instant Death Ability is So Overpowered, No One in This Other World Stands a Chance Against Me!",即死チートが最強すぎて、異世界のやつらがまるで相手にならないんですが。,"[""The other world doesn't stand a chance against the power of instant death""]","My Instant Death Ability is So Overpowered, No One in This Other World Stands a Chance Against Me!"
51678,Oniichan wa Oshimai!,"Self-professed ""home security guard"" Mahiro Oyama has not left his home in years, secluding himself in his room playing erotic visual novels. This depraved lifestyle causes his prodigious sister, Mihari, to worry about his well-being. In hopes of solving this problem, she devises a plan to rehabilitate him back to normalcy.

The first part of Mihari's plan is to concoct a medicine that changes her brother's biological constitution into a bona fide female, much to Mahiro's vehement dismay. Stuck in this predicament, Mahiro has no choice but to live out his life as a cute girl until the effect wears off—if it ever does.

[Written by MAL Rewrite]",['Comedy'],['CGDCT' 'Magical Sex Shift' 'School'],['Shounen'],['Studio Bind'],"['Pony Canyon' 'Movic' 'AT-X' 'TOHO animation' 'Tokyo MX'
 'Hakuhodo DY Music & Pictures' 'BS11' 'Egg Firm' 'Ichijinsha'
 'Bit grooove promotion' 'Pia' 'Toho Music']",Manga,12.0,Finished Airing,2023-01-05 00:00:00+00:00,2023-03-23T00:00:00+00:00,7.64,1540.0,1495.0,179499.0,2025-11-14T18:53:46.061577+00:00,Onimai: I'm Now Your Sister!,お兄ちゃんはおしまい！,['Onimai' 'Onii-chan is Done For'],Onimai: I'm Now Your Sister!
54790,Undead Girl Murder Farce,"In 19th-century France, the wife of vampire noble Jean Duchet Godard is murdered in her own home. With the local human authorities unwilling to properly investigate the case, Godard hires a pair of private detectives known to specialize in the supernatural: Tsugaru Shinuchi, a man with a mysterious birdcage; and his partner, Aya Rindou. This enigmatic duo has come from faraway Japan for one purpose—to track down the man who stole both Aya's body and Tsugaru's humanity.

[Written by MAL Rewrite]",['Fantasy' 'Mystery'],['Adult Cast' 'Detective' 'Historical' 'Urban Fantasy' 'Vampire'],[],['Lapin Track'],"['Dentsu' 'Kodansha' 'Fuji TV' 'KlockWorx' 'BS Fuji' 'Crunchyroll'
 'Tohan Corporation' 'NetEase']",Novel,13.0,Finished Airing,2023-07-06 00:00:00+00:00,2023-09-28T00:00:00+00:00,7.85,973.0,1500.0,178369.0,2025-11-14T18:53:47.863791+00:00,Undead Murder Farce,アンデッドガール・マーダーファルス,[],Undead Murder Farce
52505,Dark Gathering,"Spirits have always been attracted to Keitarou Gentouga due to his strong spiritual presence. A traumatic encounter with one had caused his right hand to be cursed, forcing him to wear a glove at all times. Now a college freshman, Keitarou is trying to live as normal a life as possible. With the encouragement of his childhood friend Eiko Houzuki, he becomes a private tutor. Since he is at the top of his intake class, his first client is the tutoring firm's most promising student, Yayoi Houzuki.

To Keitarou's surprise, Yayoi is Eiko's cousin, and she possesses two pupils in each eye—allowing her to see into the spirit world and purposely seek vengeful spirits to exorcise. Ever since a car accident killed both her parents, Yayoi has been searching for the powerful spirit that kidnapped her mother's departed soul. Seeing that spirits are so attracted to Keitarou, she ropes him into helping her collect other evil spirits that will assist in her future fight. Although her quest is dangerous, Keitarou reluctantly decides to join her, even as each new spirit they meet has him questioning his resolve at every turn.

[Written by MAL Rewrite]",['Horror' 'Supernatural'],['Gore'],['Shounen'],['OLM'],['Sotsu' 'Pony Canyon' 'Kansai TV' 'NetEase' 'BS Asahi' 'CHOCOLATE'],Manga,25.0,Finished Airing,2023-07-10 00:00:00+00:00,2023-12-25T00:00:00+00:00,7.84,1009.0,1504.0,177876.0,2025-11-14T18:53:46.640763+00:00,Dark Gathering,ダークギャザリング,[],Dark Gathering
61322,Dr. Stone: Science Future Part 2,"After a strategic maneuver, Senkuu Ishigami's team stalls Dr. Xeno's more scientifically advanced forces. A ceasefire between the two factions allows for the establishment of Corn City in North America, a hope for a future thriving population. Meanwhile, Senkuu and some of his teammates rush toward the Amazon in South America—the epicenter of the petrification beam's impact—to create Superalloy City and progress their spaceship project.

With dangerous enemies still pursuing Senkuu and his companions, it is a race against time to reach the heart of the dense Amazon. As unexpected allies and scientific creations further fuel this leg of their journey, Senkuu is closer than ever to finally uncovering the mystery behind the petrification phenomenon.

[Written by MAL Rewrite]",['Adventure' 'Comedy' 'Sci-Fi'],[],['Shounen'],['TMS Entertainment'],['TOHO animation' 'Shueisha'],Manga,12.0,Finished Airing,2025-07-10 00:00:00+00:00,2025-09-25T00:00:00+00:00,8.52,142.0,1507.0,177587.0,2025-11-14T18:53:51.290735+00:00,Dr. Stone: Science Future Part 2,Dr.STONE SCIENCE FUTURE 第2クール,['Dr. Stone 4th Season Part 2'],Dr. Stone: Science Future Part 2
56690,Re:Monster,"Tomokui Kanata has been re-incarnated in the weakest goblin, named Goburou, after having undergone an unfortunate death. However Goburou has retained his previous life's memories, an unusual evolution, as well as becoming strong enough to gain status boosts from eating.

In this alternate world of survival of the fittest, events unfold with competent subordinates and comrades, delightful case of the tail-wagging dog...",['Action' 'Adventure' 'Fantasy'],['Isekai' 'Reincarnation'],[],['Studio Deen'],"['Genco' 'Pony Canyon' 'BS11' 'Crunchyroll' 'U-NEXT' 'Muse Communication'
 'AlphaPolis' 'Saber Links' 'HIAN' 'Studio Tronc' 'Capibara']",Light novel,12.0,Finished Airing,2024-04-05 00:00:00+00:00,2024-06-21T00:00:00+00:00,6.54,7085.0,1512.0,176512.0,2025-11-14T18:53:48.597436+00:00,Re:Monster,Re:Monster,['ReMonster'],Re:Monster
39486,Gintama: The Final,"Two years have passed following the Tendoshuu's invasion of the O-Edo Central Terminal. Since then, the Yorozuya have gone their separate ways. Foreseeing Utsuro's return, Gintoki Sakata begins surveying Earth's ley lines for traces of the other man's Altana. After an encounter with the remnants of the Tendoshuu—who continue to press on in search of immortality—Gintoki returns to Edo.

Later, the regrouped Shinsengumi and Yorozuya begin an attack on the occupied Central Terminal. With the Altana harvested by the wreckage of the Tendoshuu's ship in danger of detonating, the Yorozuya and their allies fight their enemies while the safety of Edo—and the rest of the world—hangs in the balance. Fulfilling the wishes of their teacher, Shouyou Yoshida's former students unite and relive their pasts one final time in an attempt to save their futures.

[Written by MAL Rewrite]",['Action' 'Comedy' 'Drama' 'Sci-Fi'],['Gag Humor' 'Historical' 'Parody' 'Samurai'],['Shounen'],['Bandai Namco Pictures'],['TV Tokyo' 'Aniplex' 'Dentsu' 'Bandai' 'Warner Bros. Japan' 'Shueisha'],Manga,1.0,Finished Airing,2021-01-08 00:00:00+00:00,,9.05,6.0,1513.0,176404.0,2025-11-14T18:53:43.134321+00:00,Gintama: The Very Final,銀魂 THE FINAL,['N/A'],Gintama: The Very Final
53889,Ao no Exorcist: Shimane Illuminati-hen,"At True Cross Academy, Rin Okumura unknowingly comes across the first signs that something is amiss; ordinary people have been gaining the ability to perceive the invisible creatures that roam the human realm, Assiah. While Rin sees this as an opportunity to make a new friend, his twin brother, Yukio, is more burdened than ever. Swamped with his education, exorcist duties, and teaching position, Yukio has remained silent about his awakened powers, unable to understand their scale or significance.

While Rin and his friends prepare for the annual Exorcist Certification Exam, the True Cross Order has uncovered the first artificial gate to the demonic realm of Gehenna. Witnessing its size and the advanced technology that made it possible, the exorcists realize they are now dealing with the Illuminati, an extremely wealthy and powerful organization. Moreover, the inscrutable Illuminati have planted three spies in the True Cross Order—and one may be hiding among the aspiring exorcists sworn to protect mankind from the demonic threat.

[Written by MAL Rewrite]",['Action' 'Supernatural'],['Mythology' 'School'],['Shounen'],['Studio VOLN'],"['Aniplex' 'Dentsu' 'Mainichi Broadcasting System' 'Movic' 'Rakuonsha'
 'Shueisha']",Manga,12.0,Finished Airing,2024-01-07 00:00:00+00:00,2024-03-24T00:00:00+00:00,7.1,4044.0,1516.0,175960.0,2025-11-14T18:53:47.546990+00:00,Blue Exorcist: Shimane Illuminati Saga,青の祓魔師 島根啓明結社篇,['Blue Exorcist Season 3' 'Ao no Futsumashi'],Blue Exorcist: Shimane Illuminati Saga
51705,Otonari ni Ginga,"Ichirou Kuga has suddenly found himself taking on the responsibility of caring for his two younger siblings after their father's untimely death. To make ends meet, Ichirou rents out rooms in the apartment complex he inherited and works full-time as a shoujo manga artist. However, his manga sales are low, his assistants have recently left, and deadlines are fast approaching.

As stress threatens to overtake Ichirou, salvation comes in the form of an extremely competent novice artist, Shiori Goshiki, who becomes his new assistant. With her skills, they are able to tide over the difficult situation, and things begin looking up. But in a bizarre accident, a supernatural experience unfolds between Ichirou and Shirou, which leads her to declare them engaged.

With this seemingly innocuous action upending his life, Ichirou now has to manage his new and peculiar relationship with the mysterious girl, all the while following his own passion and fulfilling the duties that rest on his shoulders.

[Written by MAL Rewrite]",['Romance' 'Supernatural'],['Childcare' 'Otaku Culture'],['Seinen'],['Asahi Production'],['Kodansha' 'KlockWorx' 'Ai Addiction' 'King Records' 'Crunchyroll'],Manga,12.0,Finished Airing,2023-04-09 00:00:00+00:00,2023-06-25T00:00:00+00:00,7.16,3745.0,1520.0,175645.0,2025-11-14T18:53:46.109876+00:00,A Galaxy Next Door,おとなりに銀河,[],A Galaxy Next Door
48633,Liar Liar,"Hiroto Shinohara is a new transfer student to Academy Island, where games determine student rankings. The more games won, the more stars a student has, with the highest ranking being that of a Seven Star. On Hiroto's first day, he accidentally antagonizes Sarasa Saionji, the so-called Empress of Academy Island and granddaughter of the island's head director. Forced into a game fueled by misunderstandings that he somehow ends up winning, he is thrust into a major bluff where he must lie about his ranking or risk expulsion from the school and island.

Fortunately, with the help of the mysterious Company headed by Shirayuki Himeji, Hiroto is not alone in his bluff. The Company will do everything in its power to help him cheat his way through the game challenges sent his way by students wanting to beat him. Though he is a One Star student, he must fight as though he is actually a Seven Star, and overcome insurmountable odds in his quest to search for a missing girl from his past.

[Written by MAL Rewrite]",['Suspense'],['Psychological' 'School' 'Strategy Game'],[],['Geek Toys'],"['Shochiku' 'Studio Mausu' 'Tokyo MX' 'CyberAgent' 'Kadokawa' 'BS Asahi'
 'Bushiroad Move' 'Geek Pictures' 'qooop']",Light novel,12.0,Finished Airing,2023-07-08 00:00:00+00:00,2023-09-23T00:00:00+00:00,6.29,8618.0,1546.0,173068.0,2025-11-14T18:53:44.364969+00:00,,ライアー・ライアー,[],Liar Liar
52619,Jidou Hanbaiki ni Umarekawatta Ore wa Meikyuu wo Samayou,"A man with a passion for vending machines awakens to realize that he has not only died, but he has also been reborn as one of his beloved machines! Although he is a modern appliance in a fantasy world, he requires money in order to keep functioning. He is stuck in one location until a young girl named Lammis stumbles upon him. Amazed by the drinks and food he sells, Lammis uses her ""Blessing of Might"" to lift him with ease and take him back to the village of Clearflow Lake. There, she officially dubs him Boxxo.

Despite his inability to converse with the villagers, Boxxo becomes an essential part of the community. His goods provide nourishment, and, as he gains new abilities and products, he becomes a staple of daily life. Nobody is as loyal to Boxxo as his first and best customer, Lammis. The more time he spends with her, the more he tries to help her elevate her skills as a young hunter.

[Written by MAL Rewrite]",['Comedy' 'Fantasy'],['Isekai' 'Reincarnation'],[],['Studio Gokumi' 'AXsiZ'],"['VAP' 'Slow Curve' 'Nippon Television Network' 'Nippon Television Music'
 'Yomiuri TV Enterprise' 'BS NTV' 'NetEase' 'NTV Wands']",Light novel,12.0,Finished Airing,2023-07-05 00:00:00+00:00,2023-09-20T00:00:00+00:00,6.44,7708.0,1551.0,172309.0,2025-11-14T18:53:46.713221+00:00,"Reborn as a Vending Machine, I Now Wander the Dungeon",自動販売機に生まれ変わった俺は迷宮を彷徨う,"['I Was Reborn as a Vending Machine' 'Wandering in the Dungeon'
 'I Reincarnated Into a Vending Machine' 'Orejihanki']","Reborn as a Vending Machine, I Now Wander the Dungeon"
50184,Seiken Gakuin no Makentsukai,"The battle against the forces of evil is nearing its end as the Undead King Leonis Death Magnus remains the sole survivor of the Dark Lords. Standing no chance alone against his enemies, Leonis seals himself deep underground with the goal of reincarnating a thousand years later and rebuilding his demonic army.

Within the span of a millennium, however, everything has changed. People no longer remember the great war that led to Leonis' defeat and instead face a new threat—the monstrous creatures known as Voids. Magical devices have replaced sorcery, and humans with special powers—manifested in the form of weapons called Holy Swords—train at the Excalibur Academy to fight the Voids.

Reborn as a 10-year-old human boy, Leonis meets Riselia Ray Crystalia, a dutiful girl who stumbles upon the ruins of his hibernation chamber. Believing that Leonis has amnesia, Riselia offers him guidance and enrolls him at the Excalibur Academy. Leonis still intends to take over the world, but he must first familiarize himself with a reality completely different from all he knows.

[Written by MAL Rewrite]",['Action' 'Fantasy'],['Harem' 'Reincarnation' 'School'],[],['Passione'],"['MediaNet' 'Nippon Columbia' 'KlockWorx' 'BS Fuji'
 'NBCUniversal Entertainment Japan' 'Kadokawa' 'CTW' 'Plus Seven']",Light novel,12.0,Finished Airing,2023-10-03 00:00:00+00:00,2023-12-19T00:00:00+00:00,6.2,9079.0,1567.0,170089.0,2025-11-14T18:53:45.027437+00:00,The Demon Sword Master of Excalibur Academy,聖剣学院の魔剣使い,['Magic Sword Master of Holy Sword School'],The Demon Sword Master of Excalibur Academy
